[
  {
    "id": "wa",
    "pattern": "〜は",
    "romaji": "wa",
    "level": "N5",
    "meaning": "as for; marks the topic of the sentence",
    "formation": "Noun + は",
    "examples": [
      {
        "ja": "私は学生です。",
        "en": "I am a student."
      },
      {
        "ja": "今日は天気がいいです。",
        "en": "The weather is nice today."
      },
      {
        "ja": "この本はおもしろいです。",
        "en": "This book is interesting."
      }
    ],
    "tags": [
      "particle",
      "topic"
    ],
    "notes": "Written は but pronounced 'wa'. It sets up what the sentence is about; the key information comes after it."
  },
  {
    "id": "ga-subject",
    "pattern": "〜が（subject）",
    "romaji": "ga (subject)",
    "level": "N5",
    "meaning": "marks the subject; points out new or focused information",
    "formation": "Noun + が",
    "examples": [
      {
        "ja": "雨が降っています。",
        "en": "It is raining."
      },
      {
        "ja": "だれが窓を開けましたか。",
        "en": "Who opened the window?"
      },
      {
        "ja": "私が行きます。",
        "en": "I'll be the one to go."
      }
    ],
    "tags": [
      "particle"
    ],
    "notes": "Question words such as だれ and 何 take が, never は, when they are the subject. が is also used with 好き, ほしい, 上手 and わかる for the thing liked, wanted or understood."
  },
  {
    "id": "o",
    "pattern": "〜を",
    "romaji": "o",
    "level": "N5",
    "meaning": "marks the direct object of a verb; marks a place moved through or left",
    "formation": "Noun + を",
    "examples": [
      {
        "ja": "毎朝パンを食べます。",
        "en": "I eat bread every morning."
      },
      {
        "ja": "姉は新しいかばんを買いました。",
        "en": "My older sister bought a new bag."
      },
      {
        "ja": "公園を散歩しました。",
        "en": "I took a walk in the park."
      }
    ],
    "tags": [
      "particle"
    ],
    "notes": "Written を but pronounced 'o'. With movement verbs such as 歩く, 散歩する and 出る it marks the route or the place being left."
  },
  {
    "id": "ni-time",
    "pattern": "〜に（time）",
    "romaji": "ni (time)",
    "level": "N5",
    "meaning": "at; on; in (a specific point in time)",
    "formation": "Noun + に",
    "examples": [
      {
        "ja": "毎朝7時に起きます。",
        "en": "I get up at seven every morning."
      },
      {
        "ja": "日曜日に友達と会います。",
        "en": "I'm meeting a friend on Sunday."
      },
      {
        "ja": "8月に国へ帰ります。",
        "en": "I'm going back to my country in August."
      }
    ],
    "tags": [
      "particle",
      "time"
    ],
    "notes": "Used with clock times, dates, days of the week and months. Relative words such as 今日, 明日, 毎日 and 来週 take no に."
  },
  {
    "id": "ni-destination",
    "pattern": "〜に（destination）",
    "romaji": "ni (destination)",
    "level": "N5",
    "meaning": "to; into (the destination of movement)",
    "formation": "Noun + に + 行く / 来る / 帰る",
    "examples": [
      {
        "ja": "毎日バスで学校に行きます。",
        "en": "I go to school by bus every day."
      },
      {
        "ja": "夜10時に家に帰りました。",
        "en": "I got home at 10 p.m."
      },
      {
        "ja": "来月、姉が日本に来ます。",
        "en": "My older sister is coming to Japan next month."
      }
    ],
    "tags": [
      "particle"
    ],
    "notes": "Close in meaning to へ. に puts the focus on the arrival point, へ on the direction."
  },
  {
    "id": "ni-location",
    "pattern": "〜に（place of existence）",
    "romaji": "ni (location)",
    "level": "N5",
    "meaning": "in; at; on (where someone or something is)",
    "formation": "Noun + に + ある / いる",
    "examples": [
      {
        "ja": "机の上に辞書があります。",
        "en": "There is a dictionary on the desk."
      },
      {
        "ja": "姉は東京に住んでいます。",
        "en": "My older sister lives in Tokyo."
      },
      {
        "ja": "猫は今どこにいますか。",
        "en": "Where is the cat now?"
      }
    ],
    "tags": [
      "particle"
    ],
    "notes": "Used with ある, いる and 住む. For the place where an action happens (eat, study, play), use で instead."
  },
  {
    "id": "ni-indirect-object",
    "pattern": "〜に（indirect object）",
    "romaji": "ni (indirect object)",
    "level": "N5",
    "meaning": "to (the person who receives or is the target of an action)",
    "formation": "Noun + に",
    "examples": [
      {
        "ja": "母に手紙を書きます。",
        "en": "I'm going to write a letter to my mother."
      },
      {
        "ja": "妹に本を貸しました。",
        "en": "I lent a book to my younger sister."
      },
      {
        "ja": "友達に電話をかけました。",
        "en": "I called my friend."
      }
    ],
    "tags": [
      "particle"
    ],
    "notes": "Common with あげる, 貸す, 教える, 見せる, 電話をかける and 会う. With もらう and 借りる, に marks the person you get something from."
  },
  {
    "id": "ni-frequency",
    "pattern": "〜に（frequency）",
    "romaji": "ni (frequency)",
    "level": "N5",
    "meaning": "per; in (how many times within a period)",
    "formation": "Noun + に + Noun",
    "examples": [
      {
        "ja": "一週間に二回、プールで泳ぎます。",
        "en": "I swim in the pool twice a week."
      },
      {
        "ja": "母は一日に二回、犬の散歩をします。",
        "en": "My mother walks the dog twice a day."
      },
      {
        "ja": "一年に一度、家族で旅行します。",
        "en": "Once a year, my family goes on a trip."
      }
    ],
    "tags": [
      "particle",
      "quantity"
    ],
    "notes": "The period comes first, then に, then the number of times: 月に一回 (once a month)."
  },
  {
    "id": "e",
    "pattern": "〜へ",
    "romaji": "e",
    "level": "N5",
    "meaning": "to; toward (the direction of movement)",
    "formation": "Noun + へ",
    "examples": [
      {
        "ja": "夏休みに北海道へ行きます。",
        "en": "I'm going to Hokkaido during summer vacation."
      },
      {
        "ja": "来週、国へ帰ります。",
        "en": "I'm going back to my home country next week."
      },
      {
        "ja": "どこへ行きますか。",
        "en": "Where are you going?"
      }
    ],
    "tags": [
      "particle"
    ],
    "notes": "Written へ but pronounced 'e'. Usually interchangeable with に for destinations; へ stresses the direction a little more."
  },
  {
    "id": "de-place",
    "pattern": "〜で（place of action）",
    "romaji": "de (place)",
    "level": "N5",
    "meaning": "at; in (the place where an action happens)",
    "formation": "Noun + で",
    "examples": [
      {
        "ja": "図書館で本を読みます。",
        "en": "I read books at the library."
      },
      {
        "ja": "きのう、デパートでくつを買いました。",
        "en": "Yesterday I bought shoes at the department store."
      },
      {
        "ja": "駅の前で友達を待ちました。",
        "en": "I waited for my friend in front of the station."
      }
    ],
    "tags": [
      "particle"
    ],
    "notes": "Compare 教室にいます (being somewhere: に) with 教室で勉強します (doing something there: で)."
  },
  {
    "id": "de-means",
    "pattern": "〜で（means）",
    "romaji": "de (means)",
    "level": "N5",
    "meaning": "by; with; in (means, tool, method or language)",
    "formation": "Noun + で",
    "examples": [
      {
        "ja": "毎日電車で会社へ行きます。",
        "en": "I go to work by train every day."
      },
      {
        "ja": "はしでご飯を食べます。",
        "en": "I eat my meals with chopsticks."
      },
      {
        "ja": "日本語で手紙を書きました。",
        "en": "I wrote a letter in Japanese."
      }
    ],
    "tags": [
      "particle",
      "means"
    ],
    "notes": "To say 'on foot', use 歩いて行きます rather than で."
  },
  {
    "id": "to-and",
    "pattern": "〜と（and）",
    "romaji": "to (and)",
    "level": "N5",
    "meaning": "and (joining nouns in a complete list)",
    "formation": "Noun + と + Noun",
    "examples": [
      {
        "ja": "かばんの中にペンとノートがあります。",
        "en": "There is a pen and a notebook in my bag."
      },
      {
        "ja": "朝ご飯にパンとたまごを食べました。",
        "en": "I had bread and eggs for breakfast."
      },
      {
        "ja": "父と母は銀行で働いています。",
        "en": "My father and mother work at a bank."
      }
    ],
    "tags": [
      "particle",
      "addition"
    ],
    "notes": "と lists every item; to give just some examples, use や. It joins nouns only, not verbs or adjectives."
  },
  {
    "id": "to-with",
    "pattern": "〜と（with）",
    "romaji": "to (with)",
    "level": "N5",
    "meaning": "with; together with (a partner in an action)",
    "formation": "Noun + と",
    "examples": [
      {
        "ja": "週末、友達と映画を見ました。",
        "en": "I saw a movie with a friend on the weekend."
      },
      {
        "ja": "妹といっしょに買い物に行きます。",
        "en": "I'm going shopping with my younger sister."
      },
      {
        "ja": "だれと昼ご飯を食べましたか。",
        "en": "Who did you have lunch with?"
      }
    ],
    "tags": [
      "particle"
    ],
    "notes": "Often followed by いっしょに. With verbs like 話す, 会う and 結婚する, と marks the other person."
  },
  {
    "id": "ya",
    "pattern": "〜や",
    "romaji": "ya",
    "level": "N5",
    "meaning": "and (giving some examples out of more); ... and so on",
    "formation": "Noun + や + Noun",
    "examples": [
      {
        "ja": "机の上に本や雑誌があります。",
        "en": "On the desk there are books, magazines and so on."
      },
      {
        "ja": "スーパーで肉や野菜を買いました。",
        "en": "I bought meat, vegetables and other things at the supermarket."
      }
    ],
    "tags": [
      "particle",
      "example"
    ],
    "notes": "Suggests the list is not complete. Often ends with など: 本や雑誌など."
  },
  {
    "id": "ka-or",
    "pattern": "〜か（or）",
    "romaji": "ka (or)",
    "level": "N5",
    "meaning": "or (a choice between nouns)",
    "formation": "Noun + か + Noun",
    "examples": [
      {
        "ja": "飲み物はコーヒーか紅茶がいいです。",
        "en": "For a drink, coffee or tea would be good."
      },
      {
        "ja": "土曜日か日曜日に買い物に行きます。",
        "en": "I'll go shopping on Saturday or Sunday."
      },
      {
        "ja": "駅までバスかタクシーで行きます。",
        "en": "I'll go to the station by bus or taxi."
      }
    ],
    "tags": [
      "particle"
    ],